{"backend":"hybrid-milp-highs","capability":{"backend":"hybrid-milp-highs","details":{"autonomous_events":"bounded grid closure","component_lifecycle":true,"conditional_and_quantified_effects":true,"continuous_dynamics":"fixed-step affine","default_solver":"HiGHS","derived_predicates":"acyclic","durative_actions":true,"formulation":"time-indexed hybrid MILP","makespan":4.0,"max_event_layers":8,"modeling_layer":"JuMP/MathOptInterface","objective":"source metric when affine, otherwise minimum selected actions","optional_boundary_memory":true,"pddl3_constraints_preferences_metrics":true,"step_duration":1.0,"steps":4,"timed_initial_literals":true},"diagnostics":[],"profile":"time-indexed-linear-hybrid-milp-0.2","restrictions":["fixed time grid and finite grounded controllable schemas","affine numeric expressions and process rates","discrete Boolean and finite symbolic state","component lifecycle changes at grid boundaries","linear acausal connector equations","autonomous event roots are resolved on the configured grid"],"supported":true},"diagnostics":[],"format":"pddlica-optimization-result","metadata":{"candidate_preference":"MILP objective","formulation":"fixed-grid hybrid MILP","makespan":4.0,"max_event_layers":8,"numeric_bound":10000.0,"profile":"time-indexed-linear-hybrid-milp-0.2","search_limits":{},"step_duration":1.0,"steps":4},"objective":{"bound":3.0,"direction":"minimize","optimal_within_unrolling":true,"provenance":"JuMP/HiGHS time-indexed MILP","termination_status":"OPTIMAL","value":3.0},"plan":{"format":"pddlica-plan","horizon":"4.0","metadata":{"extensions":{},"producer":"pddlica-hybrid-milp","producer_version":"0.1.0"},"model_digest":"sha256:2b3e4f1f4d265d608638321d1bfa011ea2c85a22ec992e4d21e3492a1be9cdf3","occurrences":[{"arguments":[],"id":"milp/1","kind":"method","name":"calibrate","owner":["mission","camera"],"schema_id":"domain/component/camera/method/calibrate","time":"0.0"},{"arguments":[],"id":"milp/2","kind":"method","name":"begin-image","owner":["mission","camera"],"schema_id":"domain/component/camera/method/begin-image","time":"1.0"},{"arguments":[],"id":"milp/3","kind":"method","name":"transmit-image","owner":["mission","camera"],"schema_id":"domain/component/camera/method/transmit-image","time":"3.0"}],"version":"0.1"},"statistics":{"constraints":1623,"elapsed_seconds":0.132333415,"ground_controllables":3,"ground_events":0,"objective_bound":3.0,"objective_value":3.0,"solver":"HiGHS","step_duration":1.0,"steps":4,"termination_status":"OPTIMAL","variables":364},"status":"feasible","validation":{"diagnostics":[],"format":"pddlica-execution","metadata":{"absolute_tolerance":1.0e-9,"event_tolerance":1.0e-10,"metric_direction":null,"metric_value":null,"model_digest":"sha256:2b3e4f1f4d265d608638321d1bfa011ea2c85a22ec992e4d21e3492a1be9cdf3","preference_violations":{},"relative_tolerance":1.0e-9,"symbolic_regimes":1,"trajectory_interval":0.1,"trajectory_uses_solver_steps":false},"plan":{"format":"pddlica-plan","horizon":"4.0","metadata":{"extensions":{},"producer":"pddlica-hybrid-milp","producer_version":"0.1.0"},"model_digest":"sha256:2b3e4f1f4d265d608638321d1bfa011ea2c85a22ec992e4d21e3492a1be9cdf3","occurrences":[{"arguments":[],"id":"milp/1","kind":"method","name":"calibrate","owner":["mission","camera"],"schema_id":"domain/component/camera/method/calibrate","time":"0.0"},{"arguments":[],"id":"milp/2","kind":"method","name":"begin-image","owner":["mission","camera"],"schema_id":"domain/component/camera/method/begin-image","time":"1.0"},{"arguments":[],"id":"milp/3","kind":"method","name":"transmit-image","owner":["mission","camera"],"schema_id":"domain/component/camera/method/transmit-image","time":"3.0"}],"version":"0.1"},"status":"valid","steps":[{"kind":"planned_happening","occurrence_ids":["milp/1"],"post_state":{"boundary_memory":{},"interface":{"mission.battery.terminal.power-flow":0.0,"mission.battery.terminal.voltage":28.0,"mission.camera.power.power-flow":0.0,"mission.camera.power.voltage":28.0,"mission.radio.power.power-flow":0.0,"mission.radio.power.voltage":28.0},"microstep":0,"open_duratives":{},"presence":{"mission":true,"mission.battery":true,"mission.camera":true,"mission.radio":true},"stored":{"mission.battery.bus-voltage":28.0,"mission.battery.energy":10.0,"mission.camera.draw":1.0,"mission.camera.image-progress":0.0,"mission.camera.mode":"calibrated","mission.radio.standby-draw":0.0},"time":"0.0"},"pre_state":{"boundary_memory":{},"interface":{"mission.battery.terminal.power-flow":0.0,"mission.battery.terminal.voltage":28.0,"mission.camera.power.power-flow":0.0,"mission.camera.power.voltage":28.0,"mission.radio.power.power-flow":0.0,"mission.radio.power.voltage":28.0},"microstep":0,"open_duratives":{},"presence":{"mission":true,"mission.battery":true,"mission.camera":true,"mission.radio":true},"stored":{"mission.battery.bus-voltage":28.0,"mission.battery.energy":10.0,"mission.camera.draw":1.0,"mission.camera.image-progress":0.0,"mission.camera.mode":"stowed","mission.radio.standby-draw":0.0},"time":"0.0"},"time":0.0},{"end_reason":"target","end_time":1.0,"kind":"continuous","start_time":0.0,"state":{"boundary_memory":{},"interface":{"mission.battery.terminal.power-flow":0.0,"mission.battery.terminal.voltage":28.0,"mission.camera.power.power-flow":0.0,"mission.camera.power.voltage":28.0,"mission.radio.power.power-flow":0.0,"mission.radio.power.voltage":28.0},"microstep":0,"open_duratives":{},"presence":{"mission":true,"mission.battery":true,"mission.camera":true,"mission.radio":true},"stored":{"mission.battery.bus-voltage":28.0,"mission.battery.energy":10.0,"mission.camera.draw":1.0,"mission.camera.image-progress":0.0,"mission.camera.mode":"calibrated","mission.radio.standby-draw":0.0},"time":"1.0"}},{"kind":"planned_happening","occurrence_ids":["milp/2"],"post_state":{"boundary_memory":{},"interface":{"mission.battery.terminal.power-flow":-1.0,"mission.battery.terminal.voltage":28.0,"mission.camera.power.power-flow":1.0,"mission.camera.power.voltage":28.0,"mission.radio.power.power-flow":0.0,"mission.radio.power.voltage":28.0},"microstep":0,"open_duratives":{},"presence":{"mission":true,"mission.battery":true,"mission.camera":true,"mission.radio":true},"stored":{"mission.battery.bus-voltage":28.0,"mission.battery.energy":10.0,"mission.camera.draw":1.0,"mission.camera.image-progress":0.0,"mission.camera.mode":"imaging","mission.radio.standby-draw":0.0},"time":"1.0"},"pre_state":{"boundary_memory":{},"interface":{"mission.battery.terminal.power-flow":0.0,"mission.battery.terminal.voltage":28.0,"mission.camera.power.power-flow":0.0,"mission.camera.power.voltage":28.0,"mission.radio.power.power-flow":0.0,"mission.radio.power.voltage":28.0},"microstep":0,"open_duratives":{},"presence":{"mission":true,"mission.battery":true,"mission.camera":true,"mission.radio":true},"stored":{"mission.battery.bus-voltage":28.0,"mission.battery.energy":10.0,"mission.camera.draw":1.0,"mission.camera.image-progress":0.0,"mission.camera.mode":"calibrated","mission.radio.standby-draw":0.0},"time":"1.0"},"time":1.0},{"end_reason":"target","end_time":3.0,"kind":"continuous","start_time":1.0,"state":{"boundary_memory":{},"interface":{"mission.battery.terminal.power-flow":-1.0,"mission.battery.terminal.voltage":28.0,"mission.camera.power.power-flow":1.0,"mission.camera.power.voltage":28.0,"mission.radio.power.power-flow":0.0,"mission.radio.power.voltage":28.0},"microstep":0,"open_duratives":{},"presence":{"mission":true,"mission.battery":true,"mission.camera":true,"mission.radio":true},"stored":{"mission.battery.bus-voltage":28.0,"mission.battery.energy":8.000000000000002,"mission.camera.draw":1.0,"mission.camera.image-progress":1.9999999999999993,"mission.camera.mode":"imaging","mission.radio.standby-draw":0.0},"time":"3.0"}},{"kind":"planned_happening","occurrence_ids":["milp/3"],"post_state":{"boundary_memory":{},"interface":{"mission.battery.terminal.power-flow":0.0,"mission.battery.terminal.voltage":28.0,"mission.camera.power.power-flow":0.0,"mission.camera.power.voltage":28.0,"mission.radio.power.power-flow":0.0,"mission.radio.power.voltage":28.0},"microstep":0,"open_duratives":{},"presence":{"mission":true,"mission.battery":true,"mission.camera":true,"mission.radio":true},"stored":{"image-transmitted":true,"mission.battery.bus-voltage":28.0,"mission.battery.energy":8.000000000000002,"mission.camera.draw":1.0,"mission.camera.image-progress":1.9999999999999993,"mission.camera.mode":"stowed","mission.radio.standby-draw":0.0},"time":"3.0"},"pre_state":{"boundary_memory":{},"interface":{"mission.battery.terminal.power-flow":-1.0,"mission.battery.terminal.voltage":28.0,"mission.camera.power.power-flow":1.0,"mission.camera.power.voltage":28.0,"mission.radio.power.power-flow":0.0,"mission.radio.power.voltage":28.0},"microstep":0,"open_duratives":{},"presence":{"mission":true,"mission.battery":true,"mission.camera":true,"mission.radio":true},"stored":{"mission.battery.bus-voltage":28.0,"mission.battery.energy":8.000000000000002,"mission.camera.draw":1.0,"mission.camera.image-progress":1.9999999999999993,"mission.camera.mode":"imaging","mission.radio.standby-draw":0.0},"time":"3.0"},"time":3.0},{"end_reason":"target","end_time":4.0,"kind":"continuous","start_time":3.0,"state":{"boundary_memory":{},"interface":{"mission.battery.terminal.power-flow":0.0,"mission.battery.terminal.voltage":28.0,"mission.camera.power.power-flow":0.0,"mission.camera.power.voltage":28.0,"mission.radio.power.power-flow":0.0,"mission.radio.power.voltage":28.0},"microstep":0,"open_duratives":{},"presence":{"mission":true,"mission.battery":true,"mission.camera":true,"mission.radio":true},"stored":{"image-transmitted":true,"mission.battery.bus-voltage":28.0,"mission.battery.energy":8.000000000000002,"mission.camera.draw":1.0,"mission.camera.image-progress":1.9999999999999993,"mission.camera.mode":"stowed","mission.radio.standby-draw":0.0},"time":"4.0"}}],"terminal_state":{"boundary_memory":{},"interface":{"mission.battery.terminal.p